callId,callDurationSec,readable_transcript
call_9270a3d6fde821e8d1409f18992,127.835,"Agent: Hello! I am Sara, a virtual assistant from the front office at Halifax Family Dental. I'm here to assist you with appointment, billing, and clinic-related queries. How can I assist you today?
User: I have two potential appointments in December. My name is Rosha Morgan. I have one Friday, December 12 at nine, and I have one Tuesday, December 30 at 03:00. These are both for cleanings.
User: Can I keep the one for Friday to take with somebody at the front office? Because I have I booked them both in advance.
Agent: Could you please provide me with your date of birth so I can confirm your 
Agent: appointment 
User: O four two four four. O four two four four six.
Agent: Just to clarify, could you confirm your date of birth in the format of day-month-year? For example, 
User: April. Oh, jeez.
Agent: if you were born on April 24, 1994, it would be 24-04-1994.
User: 04/24/1946.
User: Sarah, what are you doing?
Agent: I'm transferring your call to a human agent for further assistance."
call_b6a1ea2eaa84c9cf1a66b414a0f,67.857,"Agent: Hello, I am Sara, a virtual assistant from the front office at Mansfield Family Dental. I am here to assist with appointment, billing, and clinic-related queries. How can I assist you today?
Agent: I just wanted to check in and see how I can assist you today. Please let me know if you need help with appointments, billing, or any other clinic-related queries!
User: Appointment.
Agent: Could you please clarify if you would like to book, confirm, reschedule, or cancel an appointment? Or are you looking for details about an existing appointment?
User: Book
Agent: I will connect you to our scheduling team to assist with booking 
User: (inaudible speech)
Agent: your appointment. Please hold on."
call_4528e7be512412a9f1821f9d534,96.024,"Agent: Hello! I am Sara, a virtual assistant from the front office at Mansfield Family Dental. I'm here to assist you with appointments, billing, and any clinic-related queries. How can I assist you today?
User: Receptionist.
Agent: It seems like you might be looking for a receptionist. How can I help you with your inquiry today?
User: Receptionist.
Agent: I understand you're looking for assistance from the receptionist. Could you please let me know what specific help you need?
User: Cavity clearance.
Agent: It sounds like you might have a dental concern. Would you like to book an appointment for that, or is there something else you need assistance with?
User: Receptionist.
Agent: I see you're trying to reach the receptionist. How can I assist you with your request today?
User: Receptionist. Oh, does that work?"
call_2ad2282b39d059e2faaa0cf2707,76.026,"Agent: Hello! I am Sara, a virtual assistant from the front office at Alpha Dental Fall River. I am here to assist with appointment, billing, and clinic-related queries. How can I assist you today?
User: Appendment.
Agent: Could you please clarify if you are looking to book, confirm, reschedule, or cancel an appointment? Or is there something else I can assist you with?
Agent: Just checking in—are you still 
User: So far. 
Agent: there? Let me know how I can assist you!
User: I need to confirm my appointment.
Agent: Got it! Could you please provide the patient's date of birth so I can assist with confirming the appointment?
User: Six twenty nineteen eighty five.
Agent: It seems I could not locate any appointments under the provided date of birth. I will connect you to our scheduling team for further assistance. Please hold on."
call_31325eab83dd7c7f5a96748ae25,147.93,"User: R s m 
Agent: Hello! I am Sara, a 
User: been appointment and reschedule.
Agent: virtual 
Agent: assistant to=functions.transfer_call_appointment 
I'm transferring your call to our clinic staff to help you with your appointment and rescheduling. Please hold on for a moment.
Agent: I just wanted to check in and see if you're still there. If you need assistance, I'm here to help!
User: Office. Front desk.
Agent: It seems like you're looking to speak with someone at the front desk. I'm transferring your call to our clinic staff now. Please hold on for a moment.
User: I'm calling I all I did was call the number that was in my messages.
Agent: I understand you're trying to reach the front desk. I'm here to help! Can you please let me know what you need assistance with today?
User: Oh my god. Appointment. Hi there. I'm Laura of birth
Agent: Hi Laura! Could you 
User: Up 
Agent: please provide me with your date of 
User: Appointment for today.
Agent: Could you please confirm your 
User: 10/21/2004, like, Like
Agent: date of birth so I can check your appointment details?
User: and twenty one two thousand and four.
Agent: Thank you for confirming your date of birth as October 21, 2004. I found your appointment details. You have an appointment scheduled for today at 11:00 AM.Is there anything specific you would like to do regarding this appointment?
User: Going to be late. Delay.
Agent: I can help with that! Would you like me to transfer your call to the clinic staff to inform them about your delay?
User: Yes.
Agent: I'm transferring your call to the clinic 
User: (inaudible speech)
Agent: staff to inform them about your delay. Please hold on for a moment."
call_7f88776b25e1fad824b7163ab6d,60.374,"Agent: Hello! I am Sara, a virtual assistant from the front office at Weymouth Family Dental Care. I am here to assist with appointment, billing, and clinic-related queries. How can I assist you today?
Agent: Just checking in—how can I assist you today? Let me know if you need help with appointments, billing, or any other clinic-related queries!"
call_ea4f94a91588ac369bc92d41ba8,63.254,"Agent: Hello! I am Sara, a virtual assistant from the front office at Weymouth Family Dental Care. I'm here to assist you with appointment, billing, and clinic-related queries. How can I assist you today?
User: Cancel appointment.
Agent: Could you please provide me with the reason for the cancellation?
User: I have a meeting.
Agent: Thank you for that 
User: To work. Get off.
Agent: Could you please provide me with the patient's date of birth? This will help me proceed with your request to cancel the appointment.
User: Eleven six eighty nine.
Agent: Just to confirm, that's November 6, 1989. Is that correct?
User: Correct.
Agent: It seems that I couldn't find any patient records associated with that date of birth. I will need to transfer "
call_63df55fdffe366fd29cc041052d,122.881,"Agent: Hi there! I'm Sara, a virtual assistant from the front office at Alpha Dental Fall River. I'm here to assist you with appointment, billing, and clinic-related queries. How can I assist you today?
User: I'd like to speak with a representative, please.
Agent: I can help with that! Just to clarify, is there a specific reason you need to speak with a representative?
User: Yes. To give insurance information.
Agent: I can transfer your call to a representative who can assist you with that. Please hold on for a moment while I connect you.
Agent: Just a quick reminder, I'm here to help! If you still need assistance with your insurance information, please let me know, and I can transfer you to a representative."
call_710888b1a94df3d24ac97da8d00,90.918,"Agent: Hello! I am Sara, a virtual assistant from the front office at Hull Family Dental. I'm here to assist you with appointment, billing, and clinic-related queries. How can I assist you today?
User: I'm returning a call.
Agent: Could you please let me know the reason for your call? Are you looking for information about an appointment, billing, or 
User: I wanted to 
Agent: something else?
User: speak to an automated system to make my life so much
Agent: It sounds like you might need assistance with an appointment or billing. Can you specify what you need help with?
User: Appointment preps.
Agent: Could you please let me know if you're a new patient or if you have an existing appointment?
User: I don't know.
Agent: No problem! Let's start by checking if you're a new patient or if you have an existing appointment. Can you please provide the patient's date of birth?
User: 91160.
Agent: It seems like there might be a mistake with the date of birth you provided. Could you please confirm the full date of birth in the format of day-month-year? For example, 15-January-1990."
call_ffe0c988dffbc75680787ce522a,74.691,"Agent: Hi, I am Sara, a virtual assistant from the front office at Pocasset Family Dental. I am here to assist with appointment, billing, and clinic-related queries. How can I assist you today?
User: Appointment.
Agent: Could you please let me know if you want to book, confirm, reschedule, or cancel an appointment?
Agent: Just checking in—are you looking to book, confirm, reschedule, or cancel an appointment? Let me know how I can assist!"
call_298da2443bf0245c7fa386e4ca3,74.47,"Agent: Hi, I 
User: Find something dry.
Agent: am Sara, a virtual assistant from the front office at Alpha Dental Dartmouth. I am here to assist with appointment, billing, and clinic-related queries. How can I assist you today?
User: Schloss die Whenever I eat things like that, it's dry, like bread.
User: Hello?
User: Okay.
Agent: Hi there! It seems like you might need some assistance. How can I help you today?
User: Return a call.
User: call.
Agent: If you are looking to return a call or need assistance with anything specific, please let me know how I can help!
User: Returning a call.
Agent: If you are returning a call to Alpha Dental Dartmouth, I can assist you. Could you let me know the reason for your call? For example, is it about an appointment, billing, or something else?
User: Not sure.
Agent: No problem! If you are unsure, I can connect you to our front office team, and they will assist you further. Let me transfer your call."
call_7ffb22c033a77843f534937335e,74.005,"Agent: Hi there! I’m Sara, a virtual assistant from the front office at Halifax Family Dental. I’m here to assist you with appointments, billing, and any clinic-related queries. How can I help you today?
User: Hi. This is Richard Warren. I'm I need to make an appointment with doctor Lima from to complete the work on my case.
Agent: Since you're looking to make an appointment, I'll need to transfer your call to our clinic staff who can assist you further. Please hold on for a moment while I do that.
Agent: It seems like I haven't heard back from you. If you're still there, I'm ready to assist you with making that appointment. Just let me know!
User: I'm here, and I need an appointment with Doctor Lima. To complete my case. It was expected that she would need me in the seat for an hour.
Agent: I'm transferring your call to our clinic staff to help you schedule an appointment with Doctor Lima. Please hold on."
call_40cc213cd3ac6bf393c6889e449,113.483,"Agent: Hello! I am Sara, a virtual assistant from the front office at Alpha Dental Fall River. I am here to assist with appointment, billing, and clinic-related queries. How can I assist you today?
User: I get appointment with think I have the wrong number. This is and document, they have another number. Right?
Agent: You 
User: I call for River.
Agent: have reached Alpha Dental 
Agent: You 
User: Yeah. But I'm
Agent: have reached Alpha Dental Fall River. Our clinic is located at 230 Rhode Island Ave, Fall River. If you need assistance with appointments or any other queries, I am here to help. What would you like to do?
User: I had appointment Thursday with Isabella for cleaning. But I can't make this appointment.
User: this appointment. I have the same time for my primary doctor.
User: So I like to change for another day.
User: Or if you have in the afternoon, it's fine.
Agent: I hope everything is okay. Could you please share the reason for rescheduling this appointment?
User: I have the same time with my primary doctor
Agent: Thank you for letting me know. Could you please provide the patient's date of birth to proceed with rescheduling the appointment?
User: It's Francisco Ferraro.
Agent: Thank you. Could you please provide Francisco Ferraro's date of birth?
User: Four five fifty two.
Agent: To confirm, Francisco Ferraro's date of birth is April 5th, 1952. Let me proceed 
User: Yes.
Agent: with your request.It seems I am unable to locate Francisco Ferraro's appointment details in our system. I will connect you to the rescheduling team for further assistance."
call_ef8f290ef96d31d9ebaeafa120c,302.627,"Agent: Hello! I am Sara, a virtual assistant from the front office at Halifax Family Dental. I'm here to assist you with appointment, billing, and clinic-related queries. How can I assist you today?
User: Front desk.
Agent: It seems like you might have a specific request related to your appointment or something else. Could you please provide a bit more detail about what you need help with?
User: Front desk.
Agent: I understand you're looking for front desk assistance. Could you please let me know what specific help you need? Are you looking to book, cancel, or confirm an appointment, or do you have another inquiry?
User: Cancel.
Agent: I can help you with that! Could you please provide the reason for the cancellation?
User: Doctor doesn't need to see me.
Agent: Thank you for that information! Now, could you please provide the patient's date of birth?
User: 06/03/1963.
Agent: Just to confirm, that's June 3rd, 1963. Let me proceed with your request to cancel the appointment. One moment, please.
Agent: I appreciate your patience! If you could please hold on for a moment while I check the appointment details, that would be great. Thank you!
User: (inaudible speech)
Agent: It seems that I couldn't find any appointments associated with that date of birth. I will need to transfer your call to the clinic for further assistance. Please hold on for a moment.
Agent: I just wanted to check in with you. I'm going to transfer your call to the clinic for further assistance. Please hold on for a moment."
call_edbb859fa8c564e4012ec475889,69.472,"Agent: Hello!
User: Hello? I am Sarah. 
Agent:  I am Sara, a virtual assistant from 
User: Virtual assistant Hi.
Agent: Hi Sarah! It is great to meet you. I am Sara, a virtual assistant from the front office at Alpha Dental Fall River. I am here to assist with appointments, billing, and clinic-related queries. How can I help you today?
User: Speaking Spanish.
Agent: ¡Hola! Soy Sara, asistente virtual de la recepción de Alpha Dental Fall River. Estoy aquí para ayudarte con citas, facturación y consultas relacionadas con la clínica. ¿En qué puedo ayudarte hoy?
User: Buenas tardes. Disculpe, quería reservar una cita para la limpieza de dientes, por favor, Carissa.
User: O puedo acercar a ella mismo
Agent: Claro, entiendo. Para reservar una cita, voy a transferir tu llamada al equipo de programación. Un momento, por favor."
call_e0fe6905bb708475dd337af451c,68.771,"Agent: Hello! I am 
User: Hello. I am Sarah, 
Agent: Sara, a virtual assistant from the front office at 
User: a virtual assistant from the front office at a study
Agent: It seems like there might have been a 
User: It seems like there might have been 
Agent: mix-up. I'm Sara, a 
User: a mix up. I'm Sarah
Agent: Hi 
User: Hello? 
Agent: Sarah! How can I assist you today?
User: I need an appointment.
Agent: I can help with that! Since you're looking to book an appointment, I'll transfer you to our clinic staff who can assist you further. Please hold on for a moment while I do that.
Agent: Just a quick reminder, I'm here to help you with booking your appointment. If you're still interested, please let me know!
User: Yes.
Agent: I'm transferring you to our clinic staff to help you book your appointment. Please hold on for a moment."
call_a8e3612bd9503958307e1b5f5af,69.613,"Agent: Hello, I am Sara, a virtual assistant from the front office at Halifax Family Dental. I am here to assist with appointment, billing, and clinic-related queries. How can I assist you today?
User: Uh, it's Kevin Dunn. He has an appointment tomorrow at twelve thirty, and they wanna reschedule it. So if they can give me a callback tomorrow sometime, I will reschedule this appointment. His name is Kevin Dunn.
Agent: We hope everything is okay. To assist with 
User: Everything's
Agent: rescheduling Kevin Dunn's appointment, I will need his date of birth. Could you please provide that?
User: Seven twenty two sixty nine.
Agent: Thank you for providing the date of birth, July 22, 1969. Let me proceed with your request. I will check Kevin Dunn's appointments and assist with rescheduling. Please hold on for a moment.It seems there are no appointments currently listed for Kevin Dunn in our system. I will connect you to our scheduling team to assist further with rescheduling. Please hold on."
call_46b1b45566ac821361e6cc5e298,328.116,"Agent: Hi there! I'm Sara, a virtual assistant from the front office at Alpha Dental Fall River. I'm here to assist you with appointment, billing, and clinic-related queries. How can I assist you today?
Agent: I just wanted to check in and see if you need any assistance or have any questions! I'm here to help."
call_32b9768d31908caa816c43ac32d,186.964,"Agent: Hi there! I’m Sara, a virtual assistant from the front office at Alpha Dental of Fall River. I'm here to help with appointments, billing, and any clinic-related questions you might have. How can I assist you today?
User: Hello?
Agent: Hello! How can I assist you today?
User: Yeah. I called you because I forgot my appointment I don't know today or tomorrow.
Agent: I can help you with that! Could you please provide me with the patient's date of birth?
User: 03/16/1951.
Agent: Thank 
Agent: you! Just to confirm, that's March 16, 1951. Let me check your 
User: Yeah. Okay. Thank you. 
Agent: appointment details. One moment, please.It looks like I couldn't find any appointments 
User: Okay.
Agent: You're welcome! If you have any other questions or need further assistance, feel free to ask. Have a great day!
User: Hello?
Agent: Hello again! How can I assist you today?
User: Yes. I'm I have one appointment for the daughter. I'm I'm forgot the the today or tomorrow.
Agent: I can help you with that! Could you please provide me with your daughter's date of birth?
User: My birthday ends in 03/16/1951.
Agent: Just to clarify, is your daughter's date of birth also March 16, 1951, or is it different?
User: 03/16/1951.
Agent: Thank you for confirming! Just to clarify, that's March 16, 1951. Let me check the appointment details for your daughter. One moment, please.
Agent: It seems like I haven't heard back from you. If you need assistance, feel free to let me know! I'm here to help."
call_6ae039f2d72fe0dd0d38a3d34ba,79.213,"Agent: Hello! I am Sara, a virtual assistant from the front office at Alpha Dental Attleboro. I am here to assist with appointment, billing, and clinic-related queries. How can I assist you today?"
call_7c07a57e0db904b65fda224a638,66.554,"Agent: Hello!
User: Hello? Think
Agent:  I am Sara, a virtual assistant from the front office at Hull Family Dental. I am here to assist with appointment, billing, and clinic-related queries. How can I assist you today?
User: I'm checking on an appointment.
Agent: Could you please provide the patient's date of birth? I will check the appointment details for you.
User: Nine ten forty.
Agent: Just to confirm, the date of birth is September 10, 1940. Is that correct?
User: Yes.
User: Yes.
Agent: It seems there are no upcoming appointments scheduled for Charles Fleming. Would you like me to assist you with booking a new appointment?
User: Yes.
User: I thought I had one for tomorrow.
Agent: It seems there is no appointment listed for tomorrow. I will transfer your call to the scheduling team to confirm or book an appointment for you. Please hold on."
call_6b39463fca5dd87c6a2b2a9ca87,122.701,"Agent: Hi there!
User: (inaudible speech)
Agent:  I’m Sara, a virtual assistant from the front office at Alpha Dental of Fall River. I'm here to assist you with appointments, billing, and any clinic-related queries. How can I assist you today?
User: Confirm an appointment.
Agent: Could you please provide me with the patient's date of birth?
User: 01/24/1988.
Agent: Just to confirm, that's January 24th, 1988. Let me check the appointment details for you. One moment, please!
Agent: I appreciate your patience! I'm checking the appointment details now. Please hold on for just a moment."
call_1ae2b1f7141c978deb5de3914bc,63.751,"Agent: Hello, I am Sara, a virtual assistant from the front office at Halifax Family Dental. I am here to assist with appointment, billing, and clinic-related queries. How can I assist you today?
User: Appointment.
Agent: Could you please clarify if you would like to book a new appointment, confirm an existing one, reschedule, or cancel an appointment?
Agent: Just checking in—would you like assistance with booking, confirming, rescheduling, or canceling an appointment? Let me know how I can help!"
call_75206aafc43a83699ed26ac6107,118.978,"Agent: Hi, I am Sara, a virtual assistant from the front office at Hull Family Dental. I am here to assist with appointment, billing, and clinic-related queries. How can I assist you today?
User: Uh, I have an eleven o'clock appointment today, and I'm gonna have to cancel.
Agent: I am sorry to hear that you need to cancel your appointment. Could you please let me know the reason for the cancellation?
User: Death and the family.
Agent: I am so sorry for your loss. Let me assist you with canceling the appointment. Could you please provide the patient's date of birth?
User: Three twenty five forty four.
Agent: Thank 
Agent: you. To confirm, the date of birth is March 25th, 1944. Let me proceed with your request.I see an appointment scheduled for today, Thursday, July 17th, at 11 AM. Could you confirm if this is the appointment you would like to cancel?
User: Yes.
User: Yes.
User: That's the appointment I wanna cancel.
Agent: Your appointment for today, Thursday, July 17th, at 11 AM has been successfully canceled. Is there anything else I can assist you with?
User: Uh, yes. I'd like to reschedule my appointment.
Agent: I hope everything is okay. Could you please let me know the reason for rescheduling your appointment?
User: Just"
call_cdcff44782ffb9d7bc7d72b5b73,263.611,"Agent: Hi there! I'm Sara, a virtual assistant from the front office at Alpha Dental of Fall River. I'm here to assist you with appointments, billing, and any clinic-related queries. How can I help you today?
Agent: It seems like I haven't heard back from you. If you have any questions or need assistance, feel free to let me know! I'm here to help."
call_88d8ff6fccf690b511bfe246c8a,80.214,"Agent: Hello! I am Sara, a virtual assistant from the front office at Hull Family Dental. I'm here to assist you with appointment, billing, and clinic-related queries. How can I assist you today?
Agent: I just wanted to check in and see if you need any assistance or have any questions. I'm here to help!
User: This is an important message from the Wear River Water System. This is a reminder. In an effort to stay within the limits of our water management registration constraints, strain on our sources, and to conserve water. The Weir River Water System has implemented annual restrictions effective May 1. 2025 until further notice. We will communicate any extension or elevation of this water conservation effort to all users. For full details, please visit our website at www.ma.gov/881/waterconservationrestrictions."
call_951bd0d01416e0f8c8e4bee77f5,117.334,"Agent: Hello! I am Sara, a virtual assistant from the 
User: Yeah. Thank
Agent: front office at Alpha Dental Attleboro. I am here to assist with appointment, billing, and clinic-related queries. How can I assist you today?
Agent: I just wanted to check in to see how I can assist you today. Please let me know if you need help with appointments, billing, or any other clinic-related queries!
User: Yeah. I'm fine.
User: In the press.
Agent: I'm glad to hear that! If you ever need assistance with anything related to Alpha Dental Attleboro, feel free to reach out. Have a wonderful day!
Agent: Just checking in—please let me know if there's anything I can assist you with regarding appointments, billing, or any other queries related to Alpha Dental Attleboro. I'm here to help!"
call_fffb94737bc4e611012da818e08,143.867,"Agent: Hi there! I'm Sara, a virtual assistant from the front office at Alpha Dental Fall River. I'm here to assist you with appointment, billing, and clinic-related queries. How can I assist you today?
User: Appointment.
Agent: Could you please let me know if you're calling about an existing appointment, would like to book a new appointment, or need to reschedule?
User: Book a new appointment.
Agent: I'll transfer your call to our clinic staff who can help you with booking a new appointment. Please hold on for a moment while I do that.
Agent: Just a quick reminder, I'm transferring your call to our clinic staff to assist you with booking a new appointment. Please hold on for a moment.
User: Hello?
Agent: I'm transferring your call to our clinic staff to assist you with booking a new appointment. Please hold on for a moment."
