callId,callDurationSec,readable_transcript
call_ab9448d5f3e9dac5588a951b07f,92.842,"Agent: Hi there! I'm Sara, a virtual assistant from the front office at Alpha Dental of Fall River. I'm here to assist you with appointments, billing, and any clinic-related queries. How can I help you today?
 User: Appointments.
 User: Current 
 User: appointment.
 Agent: Could you please let me know if you're a new patient or if you have an existing appointment?
 User: Existing appointment.
 Agent: Could you please provide me with the patient's date of birth?
 User: Yep. It's Gilda, g I l v a, Bouchard 31050.
 Agent: Just to confirm, is the date of birth for Gilda Bouchard March 10, 1950?
 User: Yes.
 Agent: Gilda, you have two upcoming appointments:
 
 1. On Wednesday, April 9th, 2025, at 5:15 PM.
 2. On Wednesday, April 9th, 2025, at 6:15 PM.
 
 Is there anything else I can assist you with?
 User: Could I speak to someone?
 User: I think there's a mix up.
 Agent: I'm transferring your call to a human agent for further assistance."
call_51812133aaeea182563e0febe05,148.292,"Agent: Hello! I am Sara, a virtual assistant from the front office at Mansfield Family Dental. I'm here to assist you with appointment, billing, and clinic-related queries. How can I assist you today?
User: Yes. So good afternoon, ma'am. My name is Aguirre Last time, I was there for Crown. And I had another one, and they said they're gonna send my request for insurance. I don't know if they hear anything. I gotta hear from now, Maria.
Agent: Good afternoon, Aguirre! I can help you with that. Could you please provide me with your date of birth? This will help me check your appointment details and any 
User: I'm gonna be 
Agent: updates regarding your insurance 
User: 11/1915.
Agent: Just to confirm, your date of birth is November 19, 1915, correct?
User: '19 No. November 28. November 28.
Agent: Thank you for clarifying!
User: Hello?
Agent:  Your date of birth is November 28, 1915. Let me check your appointment details and any updates regarding your 
User: No. Ninety ninety fifty No. I'm sorry. I'm sorry. I think you want us It's 11/28/1958.
Agent: Got 
Agent: it! Your date of birth 
User: ¿Aló?
Agent: is November 28, 1958. Let me check your appointment details and any updates regarding your insurance. Please hold on for a moment.I found your information, Agueda, but it looks like there are 
User: Yes.
User: Alright. Found your information
Agent: I found your information, Agueda, but it looks like there are no upcoming appointments listed for you. If you have any specific questions about your insurance request, I recommend 
User: No. I 
Agent: contacting the clinic 
User: didn't answer the question.
Agent: I 
User: Wanna 
Agent: apologize for the 
User: know if they have it because they said they just send out the question with the insurance. I wanna know if for any insurance to respond or not.
Agent: I understand now! Unfortunately, I can't check the status of your insurance request directly. Would you like me to transfer your call to someone at the clinic who can assist you with that?
User: Alright. Alright. Alright. Alright. Okay.
Agent: I'm transferring your call to the clinic for further assistance with your insurance inquiry."
call_a5795baaaefd9e2c82bb8a3dd4a,96.233,"Agent: Hello! I am Sara, a virtual assistant from the front office at Alpha Dental Franklin. I am here to assist with appointment, billing, and clinic-related queries. How can I assist you today?
User: What time is
Agent: Could you clarify what you would like to know about the time? Are you asking about our clinic's working hours or something else?
User: What time is the
Agent: It seems like your question is incomplete. Could you please clarify what you would like to know?
User: What?
User: Time is my appointment?
User: Today?
Agent: Could you please provide the patient's date of birth so I can check the appointment details for today?
User: (inaudible speech)
User: No.
Agent: Alright, if you need help with anything else, feel free to let me know!
User: What?
User: My report? Today?
Agent: It seems like you are asking about a report. Could you clarify what type of report you are 
User: Oh my
Agent: referring to? If it is related to your dental records or appointment, I can assist further.
Agent: I will transfer your call to the clinic for further assistance. Please hold on."
call_95cc354d03900e6b85bade5f893,74.925,"Agent: Hello, I am Sara, a virtual assistant from the front office at Halifax 
Agent: Family Dental. I am here to assist with appointment, billing, and clinic-related queries. How can I assist you today?
User: The phone?
User: on the phone? Yeah. Can I talk to the phone, please?
User: You're on the 
Agent: Let me 
User: phone? No. Well, they told me now. They're not even taking my teeth out Monday. I need to do a procedure so I have all the information I need at my house I take that to this this stuff. I want it done one day. I can't be taking off work. I'm just supposed to read to that. I'm gonna lose my job.
User: They asked me this, like, when I was over, doing Yeah. Can I talk to someone, please? Alright. They have all my information.
User: information. They're 0¢. Oh, it is. Wanna do a conceivance. They wanna take my cheek on.
Agent: Let me 
User: Oh, they can't do 
Agent: connect you to an 
User: it?
User: Like, that's not what?
Agent: Let me 
User: When 
Agent: connect you to an 
User: I went to Brockton, Brockton. Just took all my Tito. He didn't care.
User: They said if you go some help, you
Agent: Let me connect you to an operator 
User: Are you paying 
Agent: Let 
User: for it?
Agent: me 
Agent: Let me connect you to an operator who can assist you further."
call_35a69cd71ea8792365325d350a1,62.912,"Agent: Hello! I am Sara, a virtual assistant from the front office at Mansfield Family Dental. I'm here to assist you with appointment, billing, and clinic-related queries. How can I assist you today?
User: Email address?
Agent: I'm sorry, but I can't provide email addresses. However, I can help you with appointment scheduling or any other questions you might have. What do you need assistance with?
User: Representative.
Agent: It sounds like you would like to speak with a representative. I'll transfer your call to a human agent for further assistance. Please hold on for a moment.Transferring your call now.
User: The bot is killing me.
Agent: I understand you're feeling frustrated. I'm transferring your call to a human agent for further assistance."
call_cdce9badb2a4ab0a296c606784d,244.514,"Agent: Hi there! I’m Sara, a virtual assistant from the front office at Alpha Dental of Fall River. I’m here to assist you with appointments, billing, and any clinic-related queries. How can I help you today?
User: To confirm appointment.
Agent: Could you please provide the patient's date of birth?
User: 07/13/1963.
Agent: Just to confirm, that's July 13th, 1963. Let me proceed with your request.
Agent: I appreciate your patience! I'm going to check the appointment details for that date of birth now. Please hold on for a moment.
User: Thing left me on the phone.
Agent: I'm transferring your call to a human agent for further assistance."
call_669cd3eea43d431f97b733aaa7d,78.69,"User: Hello. This is Avidia Bank.
User: We are calling for the code needed to sign in to online banking.
User: To continue, please press or say one. Otherwise, please hang up.
Agent: I am sorry, but I cannot assist with this request. If you need help with dental-related matters, feel free to let me know!
User: We are calling for the code needed to sign in to online banking. To continue, please press or say one. Otherwise, please hang up.
Agent: I am unable to assist with this request. If you have any dental-related queries or need assistance with Halifax Family Dental, please let me know!
User: We are calling for the code needed to sign in to online banking. To continue, please press or say one. Otherwise, please hang up.
Agent: I am sorry, but I cannot assist with this request. If you need help with anything related to Halifax Family Dental, please let me know!
User: The code has expired.
User: Click the button on the online banking page to complete the call and try again.
User: Goodbye."
call_41a1888c33ee71894348d4554f2,89.456,"Agent: Hi there! I'm Sara, a virtual assistant from 
User: Hello. This is 
Agent: the front office at Hull 
User: a courtesy call from support for your QuickBooks. We're reaching out to check-in and ensure you're satisfied with your QuickBooks experience. If you're still actively using QuickBooks and would like to continue receiving support and updates, please press 1. If you are no longer using QuickBooks, please press 2 so we can update our records accordingly.
Agent: It seems like you might have reached the wrong number. This is Hull Family Dental. How can I assist you today?
User: Hello. This is a courtesy call from support for your QuickBooks. We're reaching out to check-in and ensure you're satisfied with your QuickBooks experience. If you're still actively using QuickBooks and would like to continue receiving support and updates, please press 1. If you are no longer using QuickBooks, please press 2. So we can update our records accordingly.
Agent: It looks like you've reached Hull Family Dental, not QuickBooks support. I'm here to help with dental appointments or any related 
User: Hello. 
Agent: queries. How can I assist 
User: This is a courtesy call from support for your QuickBooks. We're reaching out to check-in and ensure you're satisfied with your QuickBooks experience. If you're still actively using QuickBooks and would like to continue receiving support and updates please press 1. If you are no longer using QuickBooks, please press 2. So we can update our records accordingly.
Agent: It seems you're still trying to reach QuickBooks support. This is Hull Family "
call_83a1aedab82bb6a2fdf03011d74,61.338,"Agent: Hello, I am Sara, a virtual assistant from the front office at Halifax Family Dental. I am here to assist with appointment, billing, and clinic-related queries. How can I assist you today?
User: I don't wanna buy that.
Agent: It seems like there might be some confusion. I’m here to assist you with anything related to Halifax Family Dental, such as appointments, billing, or clinic-related queries. How can I help you today?
User: Appointments.
Agent: Thank you for letting me know. Could you please clarify if you would like to book a new appointment, confirm an existing one, reschedule, or cancel an appointment?
User: New appointments.
Agent: We are delighted to welcome new patients to our practice. I will now transfer you to our new patient coordinator for further assistance."
call_3c554a043fc8b1e08f2f1ae7eec,67.38,"Agent: Hi there! I'm Sara, a virtual assistant from the front office at Alpha Dental 
 User: No work.
 Agent: of Fall River. I'm here to assist you with appointments, billing, and any clinic-related queries. How can I help you today?
 User: Appointments. Appointment. I'll take his then.
 Agent: Could you please confirm if you would like to book a new appointment, reschedule an existing one, or confirm an 
 User: Is 
 Agent: appointment?
 User: that?
 Agent: Just to clarify, would you like to book a new appointment, reschedule an existing 
 User: Say far around it?
 Agent: one, or confirm an 
 Agent: It seems 
 User: Oh, 
 Agent: I might not be 
 User: we'll be using these.
 Agent: Iâ€™m here to help! Could you please clarify if you want to book a new appointment, reschedule an existing one, or confirm an appointment?
 User: Preschedule. Let's try that.
 User: It's a lie. 
 Agent: Great! Iâ€™ll transfer you to the clinic to help you reschedule your appointment. Just a moment, 
 User: I'm lying. Talking to a computer.
 Agent: please."
call_d078466f62783e9b4062ec6ea96,108.399,"Agent: Hello! I am Sara, a virtual assistant from the front office at Hull Family Dental. I'm here to assist you with appointment, billing, and clinic-related queries. How can I assist you today?
User: Cancel an appointment.
Agent: Could you please provide me with the reason for the cancellation?
User: Because my van can't take me.
Agent: Thank 
User: I don't 
Agent: you for sharing that.
User: have a car. I don't drive.
Agent: I understand. Could you 
User: And I rely on a van parking ride.
Agent: Could you please provide me with the patient's date of birth?
User: Seven fifteen forty six.
Agent: Just to confirm, is that July 15, 1946?
User: Yes.
Agent: I found the appointment for Marcia A. Mitchell. The appointment is scheduled for Friday, June 12th, 2025, at 2:00 PM. Would you like to cancel this appointment?
User: It's Thursday, June 12.
Agent: Thank you for the correction! The appointment is indeed on Thursday, June 12th, 2025, at 2:00 PM. Would you like to proceed with the 
User: I 
Agent: cancellation?
User: can do it. I have to reschedule.
Agent: I'm transferring your call to the clinic staff to help you reschedule your appointment."
call_5e6013cfe7d3ee84f7a7e58a218,103.177,"Agent: Hi there! I’m Sara, a virtual assistant from the front office at Alpha Dental of Fall River. I’m here to assist you with appointments, billing, and any clinic-related queries. How can I help you today?
User: You called and left a message on my voice mail.
Agent: I’m sorry for any confusion! How can I assist you regarding the message? Are you looking for information about an appointment or something 
Agent: else?
User: Yes.
Agent: Could you please let me know what specific information you need about your appointment?
User: I have an appointment on the '20 eighth or May 29. With doctor Salem.
Agent: Could you please provide me with the patient's date of birth? This will help me find the appointment details for you.
User: Two twenty six five seven.
Agent: Just to confirm, is the date of birth February 26, 1957?
User: Yes.
Agent: I found the appointment details for you. You have an appointment with Dr. Salem on Tuesday, May 28th, 2025, at 8:30 AM.Is there anything else you would like to know or do regarding this appointment?
User: No. Bobby's there.
Agent: Thank you for letting me know! If you need any further assistance in the future, feel free to reach out. Have a great day!
User: You too. Bye."
call_40d70cba32c4aa2d20f3e7d7812,71.671,"Agent: Hi there! I'm Sara, a virtual assistant from the front office at Halifax Family Dental. I'm here to assist you with appointments, billing, and any clinic-related queries. How can I assist you today?
User: Returning a call.
Agent: Could you please let me know the reason for your call? Are you looking to check on an appointment, cancel one, or 
User: Yes.
Agent: something else?
Agent: Could you 
User: Checking on an appointment.
Agent: clarify 
Agent: Could you please provide the patient's date of birth? This will help me find the appointment details for you.
User: Twelve one nineteen forty nine.
Agent: Just to confirm, that's December 1st, 1949, correct?
User: Correct.
Agent: It seems that I couldn't find any appointments associated with that date of birth. Would you like me to transfer your call to the clinic for further assistance?
User: Yes, please.
Agent: I'm transferring your call to the clinic for further assistance with your appointment."
call_7a7cf6177bf5b705b789c30b058,69.43,"Agent: Hello! I am 
User: Hello. Great.
Agent: Sara, a virtual assistant from the front office at Weymouth Family Dental Care. I'm here to assist you with appointment, billing, and clinic-related queries. How can I assist you today?
User: Appointment, please.
Agent: Are you a new patient, or do you have an existing appointment with us?
User: An existing appointment.
Agent: Could you please provide me with the patient's date of birth?
User: 03/12/1944.
Agent: Just 
Agent: to confirm, that's March 12, 1944. Let me check the appointment details for you. One moment, please.I found the appointment details for Judith Coulon. You have an appointment scheduled for today at 9:30 AM.Is there anything else you would like to know or do regarding this appointment?
User: Need to speak to live person.
Agent: I will transfer your call to a human agent for further assistance."
call_d804c6b9caa557c8cff6a4d39e2,67.644,"Agent: Hello! I am Sara, a virtual assistant from the front office at Hull Family Dental. I'm here to assist you with appointment, billing, and clinic-related queries. How can I assist you today?
User: Speak with Jill.
Agent: I can help you with that! Could you please let me know what the reason for your call is?
User: Billing.
Agent: I can transfer your call for billing-related queries. Please hold on for a moment while I connect you to the clinic staff.
Agent: Just a quick reminder, I'm here to assist you with your billing query. Would you like me to transfer your call to the clinic staff?
User: Speak with Jill.
Agent: I'm transferring your call to a human agent for further assistance."
call_b2ff176348d10d643144f667047,74.561,"Agent: Hello! I am Sara, a virtual assistant from the front office at Weymouth Family Dental Care. I'm here to assist you with appointment, billing, and clinic-related queries. How can I assist you today?
User: Appointment.
Agent: Could you please let me know if you're calling to confirm an existing appointment, cancel an appointment, book a new appointment, or reschedule an appointment?
User: Book a new appointment.
Agent: I'll transfer your call to our clinic staff, who will help you with booking a new appointment. Please hold on for a moment while I do that.
Agent: Just a quick reminder that I'm here to assist you with booking your new appointment. If you're ready, I can transfer your call to our clinic staff. Let me know!
User: Yes. I'm ready.
Agent: I'm transferring your call to our clinic staff to help you book a new appointment."
call_aaa61c889076d7504c7a3cde8b5,282.58,"Agent: Hi, I am Sara, a virtual assistant from the front office at Alpha Dental Attleboro. I am here to assist with appointment, billing, and clinic-related queries. How can I assist you today?
User: I need to change an appointment.
Agent: We hope everything is okay. Could I please know the reason for rescheduling your appointment?
User: I'm working late.
User: and I start off the phone.
Agent: Could you please provide the patient's date of birth so I can assist with rescheduling the appointment?
User: Four twenty two nineteen eighty two.
Agent: Nathan Shaw has an appointment scheduled for today, Tuesday, July 15th, at 4:15 PM. Could you confirm if this is the appointment you would like to reschedule?
User: Yeah.
User: Yes.
Agent: Could you please let me know your preferred new date for the appointment?
User: Tomorrow?
Agent: Please hold on for a few seconds while I check for the best possible slots in our system.
Agent: We found an available appointment slot for tomorrow, Wednesday, July 16th, from 7:00 AM to 7:45 AM. Would you like to book this slot?
Agent: Just checking in—would you like to book the available slot tomorrow, Wednesday, July 16th, from 7:00 AM to 7:45 AM? Let me know!
User: No.
Agent: Would you like me to check for a later time slot on the same day?
User: Yes.
Agent: Currently, there are no later time slots available for tomorrow, Wednesday, July 16th. Would you like me to check for another day?
User: Yes.
Agent: Could you please let me know your preferred new date for the appointment?
User: Next Wednesday.
Agent: Please hold 
Agent: on for a few seconds while I check for the best possible slots in our system.We found an available appointment slot for next Wednesday, July 23rd, from 7:00 AM to 7:45 AM. Would you like to book this slot?
User: No. Anytime after four fifteen PM.
Agent: Currently, there are no available slots after 4:15 PM on Wednesday, July 23rd. Would you like me to check 
User: Any 
Agent: for another 
User: day will work. Yes.
Agent: Please hold on for a few seconds while I check for the best possible slots in our system.The earliest available slot is still on Wednesday, July 23rd, from 7:00 AM to 7:45 AM. Unfortunately, there are no later slots on that day. Would you like me to keep looking for other days?
User: Yes.
Agent: Could you please confirm if you are looking for any day after 4:15 PM? I will search 
User: Yes.
Agent: accordingly.
User: Yes.
Agent: Currently, there are no available slots after 4:15 PM on Thursday, July 24th. Would you like me to continue checking for other days?
User: Yes. Any day.
Agent: The next available slot is on Monday, July 28th, from 7:00 AM to 7:45 AM. Unfortunately, there are no later slots on that day. Would you like me to keep searching?
User: Yes.
Agent: The next available slot is on Tuesday, July 29th, from 7:00 AM to 7:45 AM. Unfortunately, there are 
User: No. Operator, please. I speak 
Agent: no later slots on that day. Would you like me to 
User: with an operator?
Agent: I will transfer your call to the clinic for further assistance."
call_7b8f105b6a8a0440be85c00f3bd,80.807,"Agent: Hello! I am 
User: Hi.
Agent: Sara, a virtual assistant from the front office at Weymouth Family Dental Care. I am here to assist with appointment, billing, and clinic-related queries. How can I assist you today?
User: I would like to get the dental records, the X rays on Kevin Kaylee, Date of birth, eight three eighty nine. This is Diane from doctor Scardella in doctor Goading's dental office.
User: in Duxbury, Mass.
User: Mass.
Agent: Thank you for reaching out, Diane. Unfortunately, I am unable to assist with requests for dental records or X-rays directly. I recommend contacting our office directly at seven eight one - three three seven - zero nine seven three for further assistance. They will guide you through the process of obtaining the necessary records.Is there anything else I can assist you with?
User: Could you repeat that, please?
User: The new number?
Agent: Of course! You can contact our office directly at seven eight one - three three seven - zero nine seven three for assistance with obtaining dental records or X-rays. They will guide you through the process. Let me know if there's anything else I can help you with!
User: Thank you. Bye bye."
call_b4fbd4b360a9437e8b9f7f865f7,87.535,"Agent: Hi there! I'm Sara, a virtual assistant from the front office at Weymouth Family Dental Care. I'm here to assist you with appointments, billing, and any clinic-related queries. How can I assist you today?
User: Speak to Santosh?
Agent: It seems like you might want to speak with someone specific. Can I help you with something related to your appointment or any other query?
User: Yes.
Agent: Great! Could you please let me know what specific assistance you need? Are you looking to book, cancel, or confirm an appointment, or do you have another question?
User: Preschedule.
Agent: I can help with that! I'll need to transfer your call to our clinic staff who can assist you with scheduling your appointment. Please hold on for a moment while I do that.
Agent: Just a quick reminder! I'm here to help you with scheduling your appointment. If you're ready, I can transfer your call to our clinic staff. Let me know!
User: Yes.
Agent: I'm transferring your call to our clinic staff to help you with scheduling your appointment. Please hold on for a moment."
call_f05a7188e804ad1bde1acf5a8f7,87.877,"Agent: Hello! I am Sara, a virtual assistant from the front office at Alpha Dental Attleboro. I am here to assist with appointment, billing, and clinic-related queries. How can I assist you today?
User: Yes. My name is Maria Olivera. I like to I forgot the time I have my appointment today. Can you please tell me which what time I have the appointment today?
Agent: Could you please provide the date of birth of the patient? I will 
User: Ok. 
Agent: use it to locate the appointment details for you.
User: Okay. The that's four thirty ninety fifty three.
User: three.
Agent: Thank you for providing the date of birth. Just to confirm, is it April 30th, 1953?
User: No. No. No.
User: April thirteen one three fifty three.
User: three.
Agent: Thank 
Agent: you for clarifying! So the date of birth is April 13th, 1953. Let me check the 
User: Yes.
Agent: appointment details for you. One moment, please.Maria, you have an appointment today, Wednesday, July 9th, at 2:45 PM. Is there anything else I can assist you with?
User: No.
User: Just that. Thank you so much for your Thank you.
Agent: You are very welcome! Thank you for 
User: Bye bye.
Agent: contacting Alpha Dental Attleboro. Have a wonderful day!"
call_a0707fb255e8bd8bf1f115dcad2,62.038,"Agent: Hi there!
User: Thank you, sir.
Agent:  I'm Sara, a virtual assistant from the front office at Halifax Family Dental. I'm here to assist you with appointments, billing, and any clinic-related queries. How can I help you today?
User: I have an appointment scheduled at one I wanted to confirm this.
Agent: I can help with that! Could you please provide me with the patient's date of birth?
User: 05/02/1950.
Agent: Just to confirm, that's May 2nd, 1950, right?
User: Correct.
Agent: It seems that I couldn't find any patient records with that date of birth. Would you like me to transfer your call to the clinic for further assistance?
User: Yes, please.
Agent: I'm transferring your call to the clinic for further assistance."
